#!/powershell

# comment dialog refrence basically to formal method easy board connected
# until method social refrence govern list browser list files linked the script
# layout.

$slogan = "prjael@gmail.com"
$input = Add-Content "C:\Users\prjae\Source\Repos\Members\matrix\gnu\bin\A1\Check-Control-List\All-List\Analysis-Dialogues-Connection.ps1" Get-Host "Let Go!"
$chipset = Set-Location "C:\Users\prjae\Source\Repos\Members\matrix\gnu\bin\A1\Check-Control-List\All-List\" Get-Host "Let Section"

Where-Object {$slogan eq $input lt $chipset} {
	$file = Add-Content "C:\Users\prjae\Source\Repos\Members\matrix\gnu\bin\A1\Check-Control-List\All-List\Analysis-Dialogues-Connection.ps1"
	$super = Set-Location "C:\Users\prjae\Source\Repos\Members\matrix\gnu\bin\A1\Check-Control-List\All-List\"
	$dialog-next = Set-Location "C:\Users\prjae\Source\Repos\Members\matrix\gnu\bin\A1\Check-Control-List\All-List\Dialog-Next"
	$tools-compiler = Get-Host "powershell"
	$wind-window = Out-Host "Article 1 ver 7 constituion"
	$values = Get-Host "ID&Shallow"
	$times = Get-Item "*.ps1"
	$hopes = Get-item "C:\Users\prjae\Source\Repos\Members\matrix\gnu\bin\A1\Check-Control-List\All-List\"
	$check-cloud = Tee-Object "Analysis-Dialogues-Connection.ps1"
	$freebasic = Get-Content "Analysis-Dialogues-Connection.ps1"
    $computers = Get-Content "Analysis-Dialogues-Connection.ps1"
    $drivers = $file eq $super le $check-cloud le $freebasic lt $computers
    $lol = Tee-Object "C:\Users\prjae\Source\Repos\Members\matrix\gnu\bin\A1\Check-Control-List\All-List\LOL\LOL-Content.ps1"
    $integred = Tee-Object "C:\Users\prjae\Source\Repos\Members\matrix\gnu\bin\A1\Check-Control-List\All-List\LOL\LOL-Content.ps1"
    $database = Write-Output "Normative Arguments ..."
    $insert = Format-List $database
    $jades = $database eq  $lol le $integred lt $insert
    $version = $insert eq $database
    $cool = Select-Object $insert 
    $zip-file = $file
    	
}

if ($slogan eq $input lt $chipset){
    $business = Get-Content "Analysis-Dialogues-Connection.ps1"
    $frame92 = Get-Host "Frame 92: 54 bytes on wire (432 bits), 54 bytes captured (432 bits) on interface \Device\NPF_{0B276C9C-8013-439B-AC56-492EFCD96EAB}, id 0
    Section number: 1
    Interface id: 0 (\Device\NPF_{0B276C9C-8013-439B-AC56-492EFCD96EAB})
    Encapsulation type: Ethernet (1)
    Arrival Time: Jan  6, 2025 16:15:35.998197000 Hora Padrão de Buenos Aires
    UTC Arrival Time: Jan  6, 2025 19:15:35.998197000 UTC
    Epoch Arrival Time: 1736190935.998197000
    [Time shift for this packet: 0.000000000 seconds]
    [Time delta from previous captured frame: 0.022088000 seconds]
    [Time delta from previous displayed frame: 0.022088000 seconds]
    [Time since reference or first frame: 9.742804000 seconds]
    Frame Number: 92
    Frame Length: 54 bytes (432 bits)
    Capture Length: 54 bytes (432 bits)
    [Frame is marked: False]
    [Frame is ignored: False]
    [Protocols in frame: eth:ethertype:ip:tcp]
    [Coloring Rule Name: HTTP]
    [Coloring Rule String: http || tcp.port == 80 || http2]
Ethernet II, Src: HuaweiDevice_e9:f4:2d (90:f6:44:e9:f4:2d), Dst: CyberTANTech_7e:b8:eb (00:45:e2:7e:b8:eb)
Internet Protocol Version 4, Src: 189.125.184.251, Dst: 192.168.3.16
Transmission Control Protocol, Src Port: 80, Dst Port: 51516, Seq: 1, Ack: 288, Len: 0
"
$section_number = 1
$interface-id = 0 eq Get-Host "(\Device\NPF_{0B276C9C-8013-439B-AC56-492EFCD96EAB})"
$encapsulation-type = Get-Host "Ethernet(1)"
$arrival-time = Get-Host "Jan  6, 2025 16:15:35.998197000 Hora Padrão de Buenos Aires"
$utc-arrival-time = Get-Host "Jan  6, 2025 19:15:35.998197000 UTC"
$epoch-arrival-time = Get-Host "1736190935.998197000"
$time-shift = Get-Host "for this packet: 0.000000000 seconds"
$time-delta1 = Get-Host "from previous captured frame: 0.022088000 seconds"
$time-delta2 = Get-Host "from previous displayed frame: 0.022088000 seconds"
$time-since = Get-Host "reference or first frame: 9.742804000 seconds"
$frame-number = 92 eq "Bytes (432 bits)"
$frame-length = 54 eq "Bytes (432 bits)"
$capture-length = 54 eq "Bytes (432 bits)"
$protocals-frame = Get-Host "eth:ethertype:ip:tcp"
$coloring-rule-name = Get-Host "http"
$coloring-rule-name = Get-Host "http" || "tcp.port == 80" || "http2"
$ethernet-ii = "Src: HuaweiDevice_e9:f4:2d (90:f6:44:e9:f4:2d), Dst: CyberTANTech_7e:b8:eb (00:45:e2:7e:b8:eb)"
$internet-protocol = "Protocol Version 4, Src: 189.125.184.251, Dst: 192.168.3.16"
$trasmission-control = "Protocol, Src Port: 80, Dst Port: 51516, Seq: 1, Ack: 288, Len: 0"

}

Function Get-Ethernet {
   
    param(System.Windows.Path)
    param(System.Windows.File)
    
    $ethernet-ii = Write-Output "
Ethernet II, Src: HuaweiDevice_e9:f4:2d (90:f6:44:e9:f4:2d), Dst: CyberTANTech_7e:b8:eb (00:45:e2:7e:b8:eb)
    Destination: CyberTANTech_7e:b8:eb (00:45:e2:7e:b8:eb)
        .... ..0. .... .... .... .... = LG bit: Globally unique address (factory default)
        .... ...0 .... .... .... .... = IG bit: Individual address (unicast)
    Source: HuaweiDevice_e9:f4:2d (90:f6:44:e9:f4:2d)
    Type: IPv4 (0x0800)
    [Stream index: 0]
Internet Protocol Version 4, Src: 189.125.184.251, Dst: 192.168.3.16
Transmission Control Protocol, Src Port: 80, Dst Port: 51516, Seq: 1, Ack: 288, Len: 0
"

$src = Write-Output "Ethernet II, Src: HuaweiDevice_e9:f4:2d (90:f6:44:e9:f4:2d), Dst: CyberTANTech_7e:b8:eb (00:45:e2:7e:b8:eb)"
$dst = Write-Output "Destination: CyberTANTech_7e:b8:eb (00:45:e2:7e:b8:eb)"
$lg = Write-Output "0. .... .... .... .... = LG bit: Globally unique address (factory default)"
$ig = Write-Output "0 .... .... .... .... = IG bit: Individual address (unicast)"

 if ($src lt $dst eq $lg $ig) {
     $exec-golumes = Get-Host "Exec golumes Elements"
     $call = $src Get-Content "C:\Users\prjae\Source\Repos\Members\matrix\gnu\bin\A1\Check-Control-List\All-List\Analysis-Dialogues-Connection.ps1" eq $lg lt $ig
     $matching = $call Get-Host $dst eq $lg lt $ig
     $dialog = $call lt $exec-golumes
     $shark-exec = $exec-golumes
     $factory-exec = $exec-golumes
     $pcap = $exec-golumes

     exit 0
}

}

Function Get-Local {
    
    param(System.Windows.Path)
    param(System.Windows.File)
    param(System.Windows.Local)

    $gateway = @"Frame 92: 54 bytes on wire (432 bits), 54 bytes captured (432 bits) on interface \Device\NPF_{0B276C9C-8013-439B-AC56-492EFCD96EAB}, id 0
    Section number: 1
    Interface id: 0 (\Device\NPF_{0B276C9C-8013-439B-AC56-492EFCD96EAB})
    Encapsulation type: Ethernet (1)
    Arrival Time: Jan  6, 2025 16:15:35.998197000 Hora Padrão de Buenos Aires
    UTC Arrival Time: Jan  6, 2025 19:15:35.998197000 UTC
    Epoch Arrival Time: 1736190935.998197000
    [Time shift for this packet: 0.000000000 seconds]
    [Time delta from previous captured frame: 0.022088000 seconds]
    [Time delta from previous displayed frame: 0.022088000 seconds]
    [Time since reference or first frame: 9.742804000 seconds]
    Frame Number: 92
    Frame Length: 54 bytes (432 bits)
    Capture Length: 54 bytes (432 bits)
    [Frame is marked: False]
    [Frame is ignored: False]
    [Protocols in frame: eth:ethertype:ip:tcp]
    [Coloring Rule Name: HTTP]
    [Coloring Rule String: http || tcp.port == 80 || http2]
Ethernet II, Src: HuaweiDevice_e9:f4:2d (90:f6:44:e9:f4:2d), Dst: CyberTANTech_7e:b8:eb (00:45:e2:7e:b8:eb)
    Destination: CyberTANTech_7e:b8:eb (00:45:e2:7e:b8:eb)
        .... ..0. .... .... .... .... = LG bit: Globally unique address (factory default)
        .... ...0 .... .... .... .... = IG bit: Individual address (unicast)
    Source: HuaweiDevice_e9:f4:2d (90:f6:44:e9:f4:2d)
    Type: IPv4 (0x0800)
    [Stream index: 0]
Internet Protocol Version 4, Src: 189.125.184.251, Dst: 192.168.3.16
Transmission Control Protocol, Src Port: 80, Dst Port: 51516, Seq: 1, Ack: 288, Len: 0
"@

$section-number = 1
$interface-id = "Interface id: 0 (\Device\NPF_{0B276C9C-8013-439B-AC56-492EFCD96EAB})"
$encapsulation = "Encapsulation type: Ethernet (1)"
$arrival-id = "Arrival Time: Jan  6, 2025 16:15:35.998197000 Hora Padrão de Buenos Aires"
$utc = "UTC Arrival Time: Jan  6, 2025 19:15:35.998197000 UTC"
$apoch = "Epoch Arrival Time: 1736190935.998197000"
$Script = 'Get-CurrentTime' #Replace with Script name

$DestPath = [Environment]::GetFolderPath('MyDocuments')+"\PowerShell\Scripts"  #User's default script folder

(New-Object System.Net.WebClient).DownloadFile("https://github.com/Ayanmullick/test/raw/refs/heads/master/$Script.ps1","$DestPath\$Script.ps1")   #Download script
If (($env:PATH -split ';') -notcontains $DestPath) {$env:Path += ";$DestPath"} #Add Script folder path to environment variable, for intellisense.

$dst = "Destination: CyberTANTech_7e:b8:eb (00:45:e2:7e:b8:eb)"
$java = "Source: HuaweiDevice_e9:f4:2d (90:f6:44:e9:f4:2d)"
$type = "Type: IPv4 (0x0800)"
$stream = "[Stream index: 0]"
$internet = "Protocol Version 4, Src: 189.125.184.251, Dst: 192.168.3.16"
$trasmission = "Transmission Control Protocol, Src Port: 80, Dst Port: 51516, Seq: 1, Ack: 288, Len: 0"


}

$perlcool = @"Frame 92: 54 bytes on wire (432 bits), 54 bytes captured (432 bits) on interface \Device\NPF_{0B276C9C-8013-439B-AC56-492EFCD96EAB}, id 0
    Section number: 1
    Interface id: 0 (\Device\NPF_{0B276C9C-8013-439B-AC56-492EFCD96EAB})
    Encapsulation type: Ethernet (1)
    Arrival Time: Jan  6, 2025 16:15:35.998197000 Hora Padrão de Buenos Aires
    UTC Arrival Time: Jan  6, 2025 19:15:35.998197000 UTC
    Epoch Arrival Time: 1736190935.998197000
    [Time shift for this packet: 0.000000000 seconds]
    [Time delta from previous captured frame: 0.022088000 seconds]
    [Time delta from previous displayed frame: 0.022088000 seconds]
    [Time since reference or first frame: 9.742804000 seconds]
    Frame Number: 92
    Frame Length: 54 bytes (432 bits)
    Capture Length: 54 bytes (432 bits)
    [Frame is marked: False]
    [Frame is ignored: False]
    [Protocols in frame: eth:ethertype:ip:tcp]
    [Coloring Rule Name: HTTP]
    [Coloring Rule String: http || tcp.port == 80 || http2]
Ethernet II, Src: HuaweiDevice_e9:f4:2d (90:f6:44:e9:f4:2d), Dst: CyberTANTech_7e:b8:eb (00:45:e2:7e:b8:eb)
    Destination: CyberTANTech_7e:b8:eb (00:45:e2:7e:b8:eb)
        .... ..0. .... .... .... .... = LG bit: Globally unique address (factory default)
        .... ...0 .... .... .... .... = IG bit: Individual address (unicast)
    Source: HuaweiDevice_e9:f4:2d (90:f6:44:e9:f4:2d)
    Type: IPv4 (0x0800)
    [Stream index: 0]
Internet Protocol Version 4, Src: 189.125.184.251, Dst: 192.168.3.16
    0100 .... = Version: 4
    .... 0101 = Header Length: 20 bytes (5)
    Differentiated Services Field: 0x00 (DSCP: CS0, ECN: Not-ECT)
    Total Length: 40
    Identification: 0x020f (527)
    010. .... = Flags: 0x2, Don't fragment
    ...0 0000 0000 0000 = Fragment Offset: 0
    Time to Live: 56
    Protocol: TCP (6)
    Header Checksum: 0x0690 [validation disabled]
    [Header checksum status: Unverified]
    Source Address: 189.125.184.251
    Destination Address: 192.168.3.16
    [Stream index: 10]
Transmission Control Protocol, Src Port: 80, Dst Port: 51516, Seq: 1, Ack: 288, Len: 0
"@

$check-port =  @"Frame 92: 54 bytes on wire (432 bits), 54 bytes captured (432 bits) on interface \Device\NPF_{0B276C9C-8013-439B-AC56-492EFCD96EAB}, id 0
    Section number: 1
    Interface id: 0 (\Device\NPF_{0B276C9C-8013-439B-AC56-492EFCD96EAB})
    Encapsulation type: Ethernet (1)
    Arrival Time: Jan  6, 2025 16:15:35.998197000 Hora Padrão de Buenos Aires
    UTC Arrival Time: Jan  6, 2025 19:15:35.998197000 UTC
    Epoch Arrival Time: 1736190935.998197000
    [Time shift for this packet: 0.000000000 seconds]
    [Time delta from previous captured frame: 0.022088000 seconds]
    [Time delta from previous displayed frame: 0.022088000 seconds]
    [Time since reference or first frame: 9.742804000 seconds]
    Frame Number: 92
    Frame Length: 54 bytes (432 bits)
    Capture Length: 54 bytes (432 bits)
    [Frame is marked: False]
    [Frame is ignored: False]
    [Protocols in frame: eth:ethertype:ip:tcp]
    [Coloring Rule Name: HTTP]
    [Coloring Rule String: http || tcp.port == 80 || http2]
Ethernet II, Src: HuaweiDevice_e9:f4:2d (90:f6:44:e9:f4:2d), Dst: CyberTANTech_7e:b8:eb (00:45:e2:7e:b8:eb)
    Destination: CyberTANTech_7e:b8:eb (00:45:e2:7e:b8:eb)
        .... ..0. .... .... .... .... = LG bit: Globally unique address (factory default)
        .... ...0 .... .... .... .... = IG bit: Individual address (unicast)
    Source: HuaweiDevice_e9:f4:2d (90:f6:44:e9:f4:2d)
    Type: IPv4 (0x0800)
    [Stream index: 0]
Internet Protocol Version 4, Src: 189.125.184.251, Dst: 192.168.3.16
    0100 .... = Version: 4
    .... 0101 = Header Length: 20 bytes (5)
    Differentiated Services Field: 0x00 (DSCP: CS0, ECN: Not-ECT)
    Total Length: 40
    Identification: 0x020f (527)
    010. .... = Flags: 0x2, Don't fragment
    ...0 0000 0000 0000 = Fragment Offset: 0
    Time to Live: 56
    Protocol: TCP (6)
    Header Checksum: 0x0690 [validation disabled]
    [Header checksum status: Unverified]
    Source Address: 189.125.184.251
    Destination Address: 192.168.3.16
    [Stream index: 10]
Transmission Control Protocol, Src Port: 80, Dst Port: 51516, Seq: 1, Ack: 288, Len: 0
"@
Get-Item "C:\Users\prjae\Source\Repos\Members\matrix\gnu\bin\A1\Check-Control-List\All-List\Analysis-Dialogues-Connection.ps1"

$report-group = @"Frame 92: 54 bytes on wire (432 bits), 54 bytes captured (432 bits) on interface \Device\NPF_{0B276C9C-8013-439B-AC56-492EFCD96EAB}, id 0
    Section number: 1
    Interface id: 0 (\Device\NPF_{0B276C9C-8013-439B-AC56-492EFCD96EAB})
    Encapsulation type: Ethernet (1)
    Arrival Time: Jan  6, 2025 16:15:35.998197000 Hora Padrão de Buenos Aires
    UTC Arrival Time: Jan  6, 2025 19:15:35.998197000 UTC
    Epoch Arrival Time: 1736190935.998197000
    [Time shift for this packet: 0.000000000 seconds]
    [Time delta from previous captured frame: 0.022088000 seconds]
    [Time delta from previous displayed frame: 0.022088000 seconds]
    [Time since reference or first frame: 9.742804000 seconds]
    Frame Number: 92
    Frame Length: 54 bytes (432 bits)
    Capture Length: 54 bytes (432 bits)
    [Frame is marked: False]
    [Frame is ignored: False]
    [Protocols in frame: eth:ethertype:ip:tcp]
    [Coloring Rule Name: HTTP]
    [Coloring Rule String: http || tcp.port == 80 || http2]
Ethernet II, Src: HuaweiDevice_e9:f4:2d (90:f6:44:e9:f4:2d), Dst: CyberTANTech_7e:b8:eb (00:45:e2:7e:b8:eb)
    Destination: CyberTANTech_7e:b8:eb (00:45:e2:7e:b8:eb)
        .... ..0. .... .... .... .... = LG bit: Globally unique address (factory default)
        .... ...0 .... .... .... .... = IG bit: Individual address (unicast)
    Source: HuaweiDevice_e9:f4:2d (90:f6:44:e9:f4:2d)
    Type: IPv4 (0x0800)
    [Stream index: 0]
Internet Protocol Version 4, Src: 189.125.184.251, Dst: 192.168.3.16
    0100 .... = Version: 4
    .... 0101 = Header Length: 20 bytes (5)
    Differentiated Services Field: 0x00 (DSCP: CS0, ECN: Not-ECT)
        0000 00.. = Differentiated Services Codepoint: Default (0)
        .... ..00 = Explicit Congestion Notification: Not ECN-Capable Transport (0)
    Total Length: 40
    Identification: 0x020f (527)
    010. .... = Flags: 0x2, Don't fragment
    ...0 0000 0000 0000 = Fragment Offset: 0
    Time to Live: 56
    Protocol: TCP (6)
    Header Checksum: 0x0690 [validation disabled]
    [Header checksum status: Unverified]
    Source Address: 189.125.184.251
    Destination Address: 192.168.3.16
    [Stream index: 10]
Transmission Control Protocol, Src Port: 80, Dst Port: 51516, Seq: 1, Ack: 288, Len: 0
    Source Port: 80
    Destination Port: 51516
    [Stream index: 6]
    [Conversation completeness: Incomplete, DATA (15)]
        ..0. .... = RST: Absent
        ...0 .... = FIN: Absent
        .... 1... = Data: Present
        .... .1.. = ACK: Present
        .... ..1. = SYN-ACK: Present
        .... ...1 = SYN: Present
        [Completeness Flags: ··DASS]
    [TCP Segment Len: 0]
    Sequence Number: 1    (relative sequence number)
    Sequence Number (raw): 1856066129
    [Next Sequence Number: 1    (relative sequence number)]
    Acknowledgment Number: 288    (relative ack number)
    Acknowledgment number (raw): 605137058
    0101 .... = Header Length: 20 bytes (5)
    Flags: 0x010 (ACK)
    Window: 8192
    [Calculated window size: 65536]
    [Window size scaling factor: 8]
    Checksum: 0xfe6f [unverified]
    [Checksum Status: Unverified]
    Urgent Pointer: 0
    [Timestamps]
    [SEQ/ACK analysis]
"@
Get-Item "C:\Users\prjae\Source\Repos\Members\matrix\gnu\bin\A1\Check-Control-List\All-List\LOL\LoL-Content.ps1"

class BestFruitsOnly : Fruits {
static [enum] $FruitType = {“Apple”, “Pear”, “Orange”}
[[BestFruitsOnly]::FruitType] $InstanceFruitType
}

$security = @"Frame 92: 54 bytes on wire (432 bits), 54 bytes captured (432 bits) on interface \Device\NPF_{0B276C9C-8013-439B-AC56-492EFCD96EAB}, id 0
    Section number: 1
    Interface id: 0 (\Device\NPF_{0B276C9C-8013-439B-AC56-492EFCD96EAB})
    Encapsulation type: Ethernet (1)
    Arrival Time: Jan  6, 2025 16:15:35.998197000 Hora Padrão de Buenos Aires
    UTC Arrival Time: Jan  6, 2025 19:15:35.998197000 UTC
    Epoch Arrival Time: 1736190935.998197000
    [Time shift for this packet: 0.000000000 seconds]
    [Time delta from previous captured frame: 0.022088000 seconds]
    [Time delta from previous displayed frame: 0.022088000 seconds]
    [Time since reference or first frame: 9.742804000 seconds]
    Frame Number: 92
    Frame Length: 54 bytes (432 bits)
    Capture Length: 54 bytes (432 bits)
    [Frame is marked: False]
    [Frame is ignored: False]
    [Protocols in frame: eth:ethertype:ip:tcp]
    [Coloring Rule Name: HTTP]
    [Coloring Rule String: http || tcp.port == 80 || http2]
Ethernet II, Src: HuaweiDevice_e9:f4:2d (90:f6:44:e9:f4:2d), Dst: CyberTANTech_7e:b8:eb (00:45:e2:7e:b8:eb)
    Destination: CyberTANTech_7e:b8:eb (00:45:e2:7e:b8:eb)
        .... ..0. .... .... .... .... = LG bit: Globally unique address (factory default)
        .... ...0 .... .... .... .... = IG bit: Individual address (unicast)
    Source: HuaweiDevice_e9:f4:2d (90:f6:44:e9:f4:2d)
    Type: IPv4 (0x0800)
    [Stream index: 0]
Internet Protocol Version 4, Src: 189.125.184.251, Dst: 192.168.3.16
    0100 .... = Version: 4
    .... 0101 = Header Length: 20 bytes (5)
    Differentiated Services Field: 0x00 (DSCP: CS0, ECN: Not-ECT)
        0000 00.. = Differentiated Services Codepoint: Default (0)
        .... ..00 = Explicit Congestion Notification: Not ECN-Capable Transport (0)
    Total Length: 40
    Identification: 0x020f (527)
    010. .... = Flags: 0x2, Don't fragment
    ...0 0000 0000 0000 = Fragment Offset: 0
    Time to Live: 56
    Protocol: TCP (6)
    Header Checksum: 0x0690 [validation disabled]
    [Header checksum status: Unverified]
    Source Address: 189.125.184.251
    Destination Address: 192.168.3.16
    [Stream index: 10]
Transmission Control Protocol, Src Port: 80, Dst Port: 51516, Seq: 1, Ack: 288, Len: 0
    Source Port: 80
    Destination Port: 51516
    [Stream index: 6]
    [Conversation completeness: Incomplete, DATA (15)]
        ..0. .... = RST: Absent
        ...0 .... = FIN: Absent
        .... 1... = Data: Present
        .... .1.. = ACK: Present
        .... ..1. = SYN-ACK: Present
        .... ...1 = SYN: Present
        [Completeness Flags: ··DASS]
    [TCP Segment Len: 0]
    Sequence Number: 1    (relative sequence number)
    Sequence Number (raw): 1856066129
    [Next Sequence Number: 1    (relative sequence number)]
    Acknowledgment Number: 288    (relative ack number)
    Acknowledgment number (raw): 605137058
    0101 .... = Header Length: 20 bytes (5)
    Flags: 0x010 (ACK)
    Window: 8192
    [Calculated window size: 65536]
    [Window size scaling factor: 8]
    Checksum: 0xfe6f [unverified]
    [Checksum Status: Unverified]
    Urgent Pointer: 0
    [Timestamps]
        [Time since first frame in this TCP stream: 0.044462000 seconds]
        [Time since previous frame in this TCP stream: 0.022088000 seconds]
    [SEQ/ACK analysis]
        [This is an ACK to the segment in frame: 91]
        [The RTT to ACK the segment was: 0.022088000 seconds]
        [iRTT: 0.022250000 seconds]
"@

enum FruitType {
    Apple
    Pear
    Orange
}

class BestFruitsOnly : Fruits {
    static [FruitType] $FruitType
}

$gateway = Get-Item "C:\Users\prjae\Source\Repos\Members\matrix\gnu\bin\A1\Check-Control-List\Govern\Aliens\Analysis-Dialogues-Humans.ps1"

[Flags()]
enum FruitType {
    Apple = 1 -shl 0
    Pear = 1 -shl 1
    Orange = 1 -shl 2
    Lemon = 1 -shl 3
    Best = (1 -shl 0) -bor (1 -shl 1) -bor (1 -shl 2) # Apple, Pear, Orange
    Worst = 1 -shl 3 # Lemon
}

$isBest = ($value -band 'Best') -ne 0
$isWorst = ($value -band 'Worst') -ne 0

